{"apiVersion":"purview-execution-result/v1","executionTargetContextIdentity":"sha256:c9b4b7edbace1c47a6c609b8db3852924c5c0cca459743c7632e3fba8e035efe","failure":null,"mode":"dry-run","observedRemoteStateIdentity":"sha256:af6bfd718b0bdd54de8ba28e20e1bf5fac8e49c96a90d9e60ee4929edbd8f03e","operations":[],"planIdentity":"sha256:7bde6342ff63dd0c73ec89a08a382df37b10a0cb5b3fb2d8b456ee558700fb5e","plannedRemoteStateIdentity":"sha256:af6bfd718b0bdd54de8ba28e20e1bf5fac8e49c96a90d9e60ee4929edbd8f03e","plannedTargetContextIdentity":"sha256:c9b4b7edbace1c47a6c609b8db3852924c5c0cca459743c7632e3fba8e035efe","resultIdentity":"sha256:b093e20046f66a967655aa4e4f6c2d83e9a3155bbe42a5701d969d2687bc98f6","status":"dry-run-ready","writesAttempted":0,"writesPerformed":0,"writesUnknown":0}
